,job_id,scraped_date,country,job_name,job_post_date,job_company,job_title,job_location,job_description,job_link,job_salary
10,job_96d725e26f1aa7b3,2023-04-18,United States,Data Scientist,Staff Data Scientist,Honor,Staff Data Scientist,Remote,"Staff Data Scientist
We’re looking for data scientists to join our team. You'll develop statistical and machine learning models to improve our operations platform and help us provide a better service to our clients. We're looking for generalist data scientists who are excited to jump into new problems and write production-quality code. Leverage data to solve meaningful problems with appropriate complexity Collaborate with a diverse team across engineering, PM, and care operations to define a strategy and execute against it Research operational/logistical problems and proactively identify potential solutions. Lead the design, implementation, and evaluation of descriptive and predictive models. Integrate machine learning into user-facing applications. Mentor and provide technical oversight on teammates' projects throughout the project lifecycle. About you: Excellent communication skills with both technical and non-technical peers. Excellent mathematical and statistical fundamentals, including a degree in a quantitative field (such as Computer Science, Mathematics, Statistics, Economics, Physics) or equivalent professional experience. Wide-ranging professional experience solving complex business problems and shipping Python in a production environment. Using NLP methods to build data products from a variety of unstructured data sources, including phone calls and website forms 5+ years of industry experience. Expertise with numerical software packages such as NumPy, scikit-learn, or Keras. Able to manage product ambiguity, seeking clarity when possible. Are accountable end-to-end for your own projects, through planning, deployment, maintenance, and monitoring. You spot and address potential issues early. Bonus points if you have professional experience with: Designing systems to optimize portfolio allocation in a two-sided marketplace (E.g., ideal matches of people needing and providing care, automated financial incentives to staff remaining shifts, etc.) Using survival analysis and related methods to evaluate risk of employee churn and to predict future high-performers Collaborating with designers to develop effective methods of collecting data in order to quantify highly qualitative attributes, such as personality, taste preferences and perceived quality Applying spatial statistics to incorporate geographic and regional differences in a variety of problem contexts Our range reflects the hiring range for this position. We use national average to determine pay as we are a remote first company. Individual pay is based on a number of factors including qualifications, skills, experience, education, and training. Base pay is just a part of our total rewards program. Honor offers generous equity packages that increase with position level and responsibilities, and a 401K with up to a 4% employer match.We provide medical, dental and vision coverage including zero cost plans for employees. Short Term Disability, Long Term Disability and Life Insurance are fully employer paid with a voluntary additional Life Insurance option. We offer a generous time off program, mental health benefits, wellness program, and discount program. Hiring Salary Range$185,000—$215,000 USD
Remote

Honor exists to expand the world’s capacity to care.
We’re combining high tech with high-touch to deliver better home care for aging adults, better jobs for Care Professionals, and entirely new offerings to support the aging journey, at scale.
Founded in 2014, and now a Series E funded “Unicorn” valued at over $1B, Honor leads the world’s largest home care network with the most advanced care platform. Our August 2021 acquisition of Home Instead has created a global company that’s revolutionizing how society cares for older adults, their families, and Care Professionals.
The Honor Care Platform combines local care and the most advanced technology to bring the highest quality care to more aging adults.
Grow at Honor as part of a united team where everyone shows up authentically, shares ideas bravely, and solves complex problems!
About the Work:
We’re looking for data scientists to join our team. You'll develop statistical and machine learning models to improve our operations platform and help us provide a better service to our clients. We're looking for generalist data scientists who are excited to jump into new problems and write production-quality code.
Leverage data to solve meaningful problems with appropriate complexity
Collaborate with a diverse team across engineering, PM, and care operations to define a strategy and execute against it
Research operational/logistical problems and proactively identify potential solutions.
Lead the design, implementation, and evaluation of descriptive and predictive models.
Integrate machine learning into user-facing applications.
Mentor and provide technical oversight on teammates' projects throughout the project lifecycle.
About you:
Excellent communication skills with both technical and non-technical peers.
Excellent mathematical and statistical fundamentals, including a degree in a quantitative field (such as Computer Science, Mathematics, Statistics, Economics, Physics) or equivalent professional experience.
Wide-ranging professional experience solving complex business problems and shipping Python in a production environment.
Using NLP methods to build data products from a variety of unstructured data sources, including phone calls and website forms
5+ years of industry experience.
Expertise with numerical software packages such as NumPy, scikit-learn, or Keras.
Able to manage product ambiguity, seeking clarity when possible.
Are accountable end-to-end for your own projects, through planning, deployment, maintenance, and monitoring. You spot and address potential issues early.
Bonus points if you have professional experience with:
Designing systems to optimize portfolio allocation in a two-sided marketplace (E.g., ideal matches of people needing and providing care, automated financial incentives to staff remaining shifts, etc.)
Using survival analysis and related methods to evaluate risk of employee churn and to predict future high-performers
Collaborating with designers to develop effective methods of collecting data in order to quantify highly qualitative attributes, such as personality, taste preferences and perceived quality
Applying spatial statistics to incorporate geographic and regional differences in a variety of problem contexts
Our range reflects the hiring range for this position. We use national average to determine pay as we are a remote first company. Individual pay is based on a number of factors including qualifications, skills, experience, education, and training.

Base pay is just a part of our total rewards program. Honor offers generous equity packages that increase with position level and responsibilities, and a 401K with up to a 4% employer match.
We provide medical, dental and vision coverage including zero cost plans for employees. Short Term Disability, Long Term Disability and Life Insurance are fully employer paid with a voluntary additional Life Insurance option. We offer a generous time off program, mental health benefits, wellness program, and discount program.
Hiring Salary Range
$185,000—$215,000 USD
What’s next?
Honor is remote friendly! We're hiring across the U.S., with an entirely virtual interview and onboarding process. Most of our positions are remote/work from home and do not require permanent relocation. As conditions allow, we have office space for in-person collaboration in our San Francisco Bay Area, CA and Austin, TX hubs. If you're looking for a great job that offers you the opportunity to work from home, we'd love to talk to you.
Want to know more about why Honor is a great place to work? Check out our perks!

We value people! These four people-centric values guide the ways we work and decisions we make every day.
This role doesn’t sound quite right? Send this application to a friend who may be a fit and check out our other available roles!
#LI-Remote
Honor is an equal opportunity employer. All qualified applicants will receive consideration for employment without regard to race, color, religion, sex (including pregnancy), national origin, age, disability, genetic information, political affiliation or belief.",https://www.indeed.com/rc/clk?jk=96d725e26f1aa7b3&fccid=d12645453d9cc8ea&vjs=3,"$185,000 - $215,000 a year"
11,job_20c8f542b3f17ed7,2023-04-18,United States,Data Scientist,Associate Data Scientist - Rotational Program,Mutual of Omaha,Associate Data Scientist - Rotational Program,Remote,"Location: Various Locations
Work Type: Full Time Regular
Job No: 502186
Categories: Analytics/Data Science
Application Closes: Open Until Filled
The rADS Program is a training program designed to provide early-in-career data scientists with the opportunity to work on diverse projects and gain exposure to different areas within Mutual of Omaha. The program lets the associate data scientists rotate through different teams within our company, allowing them to gain experience in different aspects of data science and build a well-rounded skill set.

WHAT YOU'LL DO:
Collaborate with business partners to understand business objectives/goals and develop a clear and well-defined analytic plan.
Support the analytic life cycle.
Performs data extraction and data manipulation.
Explore data to understand and articulate the data profile and its limitations.
Assist in the development of predictive modeling and association modeling such as segmentation analysis, data modeling, risk modeling, behavioral analysis, cross-selling analysis, and customer churn analysis.
Develop trusted outcomes by applying appropriate analytical techniques and metrics.
Support the deployment and maintenance of the analytic model.
Communicate clear outcomes at varying levels of detail to our business partners.


ABOUT YOU:
You help promote a culture of diversity and inclusion within the department and the larger organization. You value different ideas and opinions. You listen courageously and remain curious in all that you do.
You are able to work remotely and have access to high-speed internet.
Must be located in United States or Puerto Rico.
Undergraduate degree in analytically driven fields such as mathematics, statistics, physics, economics, data science, computer science, operations research, or actuarial science.
Ability to write SQL to gather data.
Proficient in Python and R; proficient in statistical analysis and machine learning.
Basic understanding of data visualization.
Knowledge of structured data platforms.
Adequate verbal and written communication and human relations skills.
Strong problem-solving skills and a high level of intellectual curiosity.
We recognize that people come with diverse experience and talent beyond just the requirements of the job. Diversity of experience and skills combined with passion is a key to innovation and excellence. If your experience is relevant to what you see listed, please consider applying – we’d love to hear from you!

VALUABLE EXPERIENCE:
Graduate degree in analytically driven fields such as mathematics, statistics, physics, economics, data science, computer science, operations research or actuarial science.
Database and/or engineering skills a plus.
Product and industry knowledge.
Strong business acumen.
Associate or Fellow in Society of Actuaries.

WHAT WE CAN OFFER YOU:
A diverse workplace where associates feel a sense of belonging. To learn more about our commitment of Diversity, Equity and Inclusion, please visit our website
An organization that feels like a small, close-knit community and has the strength of a Fortune 500 company.
Tuition reimbursement, training and career development.
Comprehensive benefits plan that includes medical, dental, vision, disability and life insurance.
Flexible spending accounts for healthcare and childcare needs.
401(k) plan with a 2% company contribution and 6% company match.
Competitive pay with an opportunity for incentives for all associates.
Flexible work schedules with a healthy amount of paid time off.
For more information regarding available benefits, please visit our Career Site.
Salary Range: $72,000 - $114,000
Pay commensurate with experience.
Recognized as a certified Great Place to Work®.


MUTUAL OF OMAHA:
Mutual of Omaha serves more than 4.8 million individual product customers and 39,000 employer groups. Our legacy of stability creates an environment where every associate is encouraged to experiment, innovate and grow in their own unique career path.
From day one, you’ll have the tools to be your best self at work. Here you’ll do meaningful work and your talents will have a positive impact on peoples’ lives as we help our customers protect what they care about and achieve their financial goals.
Each associate is a unique contributor to creating a diverse, dynamic, thriving and inclusive workplace. We want you to become engaged … feel a sense of belonging … and contribute to the company’s exceptional future.
We are committed to optimizing flexible work. We support a full range of work approaches: fully remote, hybrid and in-person. Many of our roles are remote. Employees in remote roles may occasionally travel to a Mutual of Omaha office or elsewhere for required meetings or team-building events. Remote employees who are assigned a Mutual of Omaha office location can work on-site on a voluntary basis, subject to local and company COVID-19 guidelines.
Join forces with a company that can AMPLIFY YOUR STRENGTHS AND EMPOWER YOUR CAREER.

For inquiries about the position or application process, contact our HR Helpline at 1-800-365-1405.
If you are a qualified individual with a disability or a disabled veteran, you have the right to request an accommodation if you are unable or limited in your ability to use or access our career center as a result of your disability. To request an accommodation, contact a Human Resources Representative at 1-800-780-0304. We are available Monday through Friday 7 am to 4:30 pm CST we will reply within 24 hours.
Mutual of Omaha and its affiliates are an Equal Opportunity /Affirmative Action Employer. Qualified applicants will receive consideration without regard to race, color, religion, sex, sexual orientation, gender identity, national origin, disability or protected veteran status.
To All Recruitment Agencies: We do not accept unsolicited agency resumes and we are not responsible for any fees related to unsolicited resumes.
Circa
Help: 800-365-1405",https://www.indeed.com/rc/clk?jk=20c8f542b3f17ed7&fccid=7f07a4e82fbeccf8&vjs=3,"$72,000 - $114,000 a year"
12,job_f703040fa9de2856,2023-04-18,United States,Data Scientist,Lead Data Scientist,OBMedia,Lead Data Scientist,Remote,"If you are motivated by a fast growing company where you can really make an impact, enjoy the fully-remote, small-company lifestyle, and are comfortable with the rewards and challenges of working with a diverse array of business, technical, and analytical problems, then we would love to work with you!

The Role
We are looking for a Lead Data Scientist to join our growing Data Science & Analysis team. Overseeing a team of three Data Analysts, the candidate would work with leadership, and other departments to pursue opportunities to further understanding, boost productivity, and deliver results.
Our team engages in a wide range of projects on large streams of online advertising behavioral data. Our work ranges from tactical observational analysis, to ambitious ML projects, ultimately supporting and contributing to OBMedia's ambitious growth strategies.
Reports to Chief Data Officer

Essential Functions & Responsibilities
Be the point of contact on major team projects and strategies
Collaborate with analysts and data engineering on algorithm / models / pipeline development
Make key contributions to understanding projects, defining metrics, and outputs
Interact and form cross-functional teams to deliver on major projects
Pursue opportunities to prototype, and demonstrate the potential of ideas
Effective communication with leadership, technologists and business teams
Skills & Background
3+ years leading projects, and managing teams
Experience with a variety of statistical and machine learning methods
History of delivering business integration of Data Science solutions
Facility with extracting and manipulating large data sets in cloud environments
Understanding of scalable Python/Spark/SQL code and backend API for web applications
A degree in a STEM related discipline
Prefer demonstrable contributions to open source projects and/or kaggle competitions
Benefits
100% Employer Paid Health, Dental and Vision coverage for Employees
401(k) at a 4% match
4 Weeks PTO
Performance based annual bonuses
Home office allowances
Work sponsored travel
About OBMedia
We are a small, profitable company that has been working remotely long before it became trendy. Growing from a startup in 2001 to one of the most trusted and established Ad Networks in the industry, we partner with some of the biggest names in tech to connect publishers, relevant advertisers and diverse audiences.
OBMedia is a subsidiary of the Enero Group, a publicly-held, international network of marketing and communications firms listed on the Australian Stock Exchange. This combination creates the opportunity to work autonomously in a startup-like environment, while enjoying the stability provided under the larger corporate umbrella.

The Team
We are a steadily growing and fully remote team of media buyers, analysts, engineers, and strategic thinkers that enjoy the autonomy and innovation of a startup environment. Located around the world, we are united in our passion to continually learn, grow, and build.
Internet advertising is a complex and fast paced marketplace and we compete in many areas of it while constantly exploring new opportunities. Doing so successfully requires a dedicated team, working together to find and take advantage of those opportunities. We’ve been doing this successfully since 2001, and we’re pretty good at it. We are looking for people who help us be better.",https://www.indeed.com/rc/clk?jk=f703040fa9de2856&fccid=616700522c49f565&vjs=3,"$160,000 - $230,000 a year"
13,job_dad427ea48912538,2023-04-18,United States,Data Scientist,Data Scientist (CATALYST) June 2023 Start,AGCO,Data Scientist (CATALYST) June 2023 Start,"Duluth, GA 30096
+2 locations","Data Scientist (CATALYST) - REMOTE

Who we are looking for:

We are looking for someone who is excited about a career in the Data & Analytics and passionate about providing industry-leading smart farming solutions to sustainably feed our world. AGCO is a global leader in the design, manufacture and distribution of agricultural machinery and precision Ag technology driving farmer-focused solutions. This role is part of CATALYST, AGCO’s Rotational Development Program.

CATALYST

CATALYST will offer you three 6-month rotations in data and analytics over a total of 18 months to build up knowledge in building database capabilities, developing analytics and advancing analytics, in addition to essential business and soft skills. The rotations will be in various business areas, including strategy, engineering, IT and customer solutions.

Upon successful completion of the program, you will have career opportunity as a Data Scientist, Data Engineer or other Data & Analytics roles at AGCO. Candidates who apply for this program, should be interested in a long-term career path with AGCO. By joining CATALYST, you will discover the endless career opportunities through a strong foundation of data & analytics and understanding of our customers – farmers.

What you will do (varies by rotation):

As part of the CATALYST, you will interact and work with other CATALYST trainees from different functions, such as sales and marketing, engineering, IT, etc., to build up a professional network that will benefit the rest of your career. The program also includes group development activities, such as facilities tours, customer visits, hands-on farming and machinery experience, continual education, mentorship, professional development workshops, and more.
During the program you be responsible for developing statistical analysis and AI/machine learning techniques to carry out descriptive, diagnostic, predictive and prescriptive analytics use cases in support of making farmers more productive and profitable.
This role utilizes analytical, statistical, and programming skills to collect, analyze, and interpret large data sets. This information is then used to develop data-driven solutions to difficult business challenges which will enable industry leading, smart farming solutions.
The successful candidate will participate in the adoption and advancement of analytics maturity within AGCO through the collaboration with stakeholders, delivery of insights and explanation of analysis.
Responsibilities may vary based on the person’s experience, skillset, and assigned rotations.
Travel Requirement: <20% for meeting, training, and events during the CATALYST program

What you will bring:

Bachelor’s degree or equivalent work experience in related field
Advanced analytics skills (Python, R, SAS, SQL etc.) to carry out statistical and machine learning analysis
Familiar with cloud technologies for model development and deployment
Fluency in English
Excellent analytical and problem-solving skills

A plus if you have:

Big data computing frameworks for processing of large data volumes (AWS Glue, EMR and Sagemaker)

What we offer:

Experience our global diversity and enterprising spirit while helping us create innovative technologies and a positive impact that helps feed the world’s nearly 8 billion people. From the day you decide to join AGCO, we want to engage and excite you and we’re clear on where we want to go as a business and we trust you to help us there. Whether you want to learn a new skill or you aspire to do something different, we can help you develop the skills you need to take your career - and our business - to the next level.

We also invite you to “Make the Most of YOU” - Benefits include: health care and wellness plans, flexible and virtual work options (where available), 401(k) Savings Plan with company match, paid holidays and paid time off, flexible spending accounts, reimbursement for continuing education, company philanthropic programs, company perks programs, and much more…

Please note that this job posting is not designed to cover or contain a comprehensive listing of all required activities, duties, responsibilities or benefits and may change at any time with or without notice.

AGCO is proud to be an Equal Opportunity Employer.
We maintain a drug-free workplace and perform pre-employment substance abuse testing.

AGCO is a global leader in the design, manufacture and distribution of agricultural engineering with a portfolio of exciting international brands which deliver solutions to farmers in 140 countries through a full line offer from tractors and combine harvesters to protein production systems and smart farming software solutions – to an environment where the future is happening now. Join us as we bring agriculture into the future.",https://www.indeed.com/rc/clk?jk=dad427ea48912538&fccid=d576b5b1f45626a0&vjs=3,Estimated $90.5K - $115K a year
