,job_id,scraped_date,country,job_name,job_post_date,job_company,job_title,job_location,job_description,job_link,job_salary
0,job_e62ab79d743fe459,2023-04-18,United States,Data Scientist,Data Scientist / Sr Data Scientist (fully remote),Hill's Pet Nutrition,Data Scientist / Sr Data Scientist (fully remote),"Remote in Topeka, KS",,https://www.indeed.com/rc/clk?jk=e62ab79d743fe459&fccid=8ffd82d10d56fd60&vjs=3,"$77,120 - $140,000 a year"
1,job_d474e9aacf32c393,2023-04-18,United States,Data Scientist,AI engineer,Sticker Mule,AI engineer,Remote,"About Sticker Mule
Sticker Mule is the Internet's most ""kick ass"" brand. We are privately-owned, profitable, and powered by a globally distributed team that enjoys building happy customer experience at the highest technical standards. Our software team operates from 17 countries, and we're always looking for more exceptional engineers.
The Machine Learning team is responsible for building and maintaining our ML-assisted tools likeTrace andUpscale.
See more about our teams here
We offer
Remote work with flexible schedules
Varied, interesting technical challenges to solve
A fun ""no bullshit"" work environment
We like you to know
Python
PyTorch
Transformers, Diffusion, RNNs, CNNs
Familiarity with Computer Vision
Excellent communication skills (English)
Challenges
Improve our ML-assisted tools
Train new models for upcoming projects
Maintain optimal performance at scale
Compensation and benefits
Salary: $135+ based on experience
$20,000 signing bonus
4 weeks vacation (+ holidays based on your country of residence)",https://www.indeed.com/rc/clk?jk=d474e9aacf32c393&fccid=8363d1ab1997f5d7&vjs=3,From $135 a day
2,job_d8b8004bf25ed876,2023-04-18,United States,Data Scientist,Associate Data Scientist,AppFolio,Associate Data Scientist,Remote,"At AppFolio, we paddle as one. We ride and make waves together, with a relentless focus on building great products for the way our customers work and live today – and tomorrow. AppFolio is a destination organization where careers are made and accelerated. Here, innovation is a team sport.

The Associate Data Scientist will maximize product quality and adherence to FCRA compliance requirements; optimize operations for our tenant screening teams, while testing and developing product improvements to ensure alignment with legal regulatory standards.

Your impact

Deliver growth opportunities through experimentation, analysis and new data/analytics products and services
Increase accuracy and improve data quality for the product

Qualifications
“Data driven” means our narratives, interpretations, and conclusions are based on results from analysis and do not lead analysis.

Anticipate Risks: We consider any potential risk of harm with results to any relevant population (e.g., customers, customers’ customers, etc.) and use this as part of our decision to conduct analyses and if so, how to do so ethically.
Consider All Variables: We consider a wide range of potential variables to consider in analysis to ensure analyses are thorough and as objective as possible.
Approach Testing Scientifically: Testing criteria are established by scientific means in order to avoid any bias towards particular groups/cohorts.
Build Models Transparently & Ethically: Model inputs and their contribution to model results/decisions are transparent, understood, and documented. Productionized models are regularly assessed for unethical feedback loops or impacts.
Impact-Aware: Decision making connected to our tests and models consider impact to all relevant populations, including but not limited to the business.
Must Have
BS or higher in Computer Science, Mathematics, Statistics or a related field; or equivalent professional experience.
Minimum of 3-5 years of work experience in a Data Analyst role.
Strong Tableau, SQL, R (or Python), and Excel skills required.
Working knowledge of Salesforce suggested.
Ability to support, work on and communicate with a fast, cross-functional team.
Nice to have
Help build predictive, machine-learning models to enable business decisions.
Create/enable/track/analyze cross-functional data experiments.
Provide analysis and insights on key performance drivers and opportunities.
Assist in financial analyses, including month-end close, annual budget and quarterly forecasting.
Compensation & Benefits
The base salary/hourly wage that we reasonably expect to pay for this role is: $84,000 - 126,000
The actual base salary/hourly wage for this role will be determined by a variety of factors, including but not limited to: the candidate’s skills, education, experience, etc.
Please note that base pay is one important aspect of a compelling Total Rewards package. The base pay range indicated here does not include any additional benefits or bonuses/commissions that you may be eligible for based on your role and/or employment type.

Regular full-time employees are eligible for benefits including but not limited to:
Paid Time Off (PTO)
Medical, dental, and vision benefits
Long-term and short-term disability insurance
401(k)
Wellness benefits
Interns / full-time temporary / eligible variable hour employees are eligible for benefits including but not limited to:
Medical
401(k)
Wellness benefits

Why AppFolio

We ride and make waves together, with a relentless focus on building great products for the way our customers work and live today — and tomorrow. AppFolio is a destination organization where careers are made and accelerated. Here, innovation is a team sport.

Paddle as One.

Learn more at appfolioinc.com/careers
#LI-JH1",https://www.indeed.com/rc/clk?jk=d8b8004bf25ed876&fccid=1a5bf8d2e39d8e2e&vjs=3,"$84,000 - $126,000 a year"
3,job_8a3e6435326f3596,2023-04-18,United States,Data Scientist,Data Scientist,Cadent,Data Scientist,"Philadelphia, PA 19102 
(City Center West area)","Cadent powers the evolution of TV brand advertising. We provide marketers, agencies, operators, and media owners with data-driven solutions for buying and selling TV advertising. By connecting brands with opportunities across national inventory sources—cable, broadcast, and digital media—our technology improves efficiencies and boosts the results of linear, addressable, and cross-screen campaigns.
Right now we are looking for a highly motivated Data Scientist who will be responsible for applying scientific methods to identify business optimization strategies and develop, evaluate and demonstrate prototypes of empirical software including but not limited to machine learning, signal processing and optimization based numerical methods.
Data Scientists collaborate directly with the Business Intelligence, Data Engineering and Development team members to productize research as reporting and business software. This is a critical mathematical engineering role whose work is leveraged by other engineers and by senior executives to define the future of Cadent.
Our ideal player will:
Design, train and apply statistics, mathematical models, and machine learning techniques to create scalable solutions for predictive learning, forecasting and optimization
Work with Software development team to deploy models as micro-services leveraged inside of business software products
Monitor, maintain, and refine predictive models as necessary, including re-training
Work with product team to align software goals with KPI’s via empirical measure of effectiveness
Participate in the agile / scrum process
Follow the CRISP-DM process to generate robust documentation associated with iterative work
Present results to technical and business stakeholders.
Collaborate effectively with other members of the engineering research team and broader data services group including but not limited to Data Engineers, Analytics Engineers, Performance Engineers, Software Engineers and Business Intelligence analysts
Our ideal player will have:
M.S. or higher in computer science, mathematics,or related discipline with a focus on machine learning or the equivalent of 4vs. 5 in the sr. role. years of experience in machine learning, forecasting and
Practical experience building evaluating and deploying machine learning pipelines as with python, preferably with the scikit- learn ecosystem Sr. roles says AWS or GCP
Experience with SQL, accessing and organizing data drawn from relational databases
Experience in cloud computing ecosystems (preferably in AWS)
Practical experience in deep learning architectures and frameworks is a plus
Proven background answering open ended research questions using data
Experience with computational statistics and understanding of theoretical fundamentals of statistics
Strong analytical and quantitative problem-solving ability.
Fundamental understanding of the mathematical workings of standard feature engineering and machine learning algorithms.
Demonstrated communication skills including the ability switch between technical and business contexts.
Preferably a background in software development
Extra Credit if you have:
Media Experience
AWS, GCP

If the leading edge of media technology is the place you want to be, please contact us today and let’s start the conversation!
Cadent is an Equal Opportunity Employer and is committed to supporting all it’s employees when it comes to Inclusion & Diversity. Cadent’s policy is to provide equal opportunity for applicants & employees without regard to race, color, religion, creed, gender, gender identity or expression, sexual identity or orientation, age, national origin or ancestry, citizenship, disability or medical condition (including pregnancy, childbirth, or related medical condition), sexual and reproductive health decisions, genetic information, marital status (including domestic partnerships and civil unions), pregnancy, culture ancestry, familial or caregiver status, military status, veteran status, socioeconomic status, unemployment status, status as a victim of domestic violence or any other basis prohibited by law. and will not discriminate against the basis of disability. This commitment is honored when it comes to decisions on hiring, recruiting, training, promotions, compensations, benefits, transfers and terminations.
Cadent is seeking to actively engage with our employees from a wide variety of cultures and to connect with our clients differently. Our workforce has generational diversity that supports greater innovation when we maximize representation of all diversity. Our active employee resource groups promote engagement across all groups of individuals that are represented within the company and externally

Flexible work from home options available.",https://www.indeed.com/rc/clk?jk=8a3e6435326f3596&fccid=760d03f6c6eab030&vjs=3,Estimated $115K - $146K a year
4,job_3af02d93417e951c,2023-04-18,United States,Data Scientist,Junior Data Scientist,Augray,Junior Data Scientist,"Remote in Brookfield, WI","Brookfield, WI, USA
Summary:
Hiring Fresher to 1 year experience in Data Science, ML with python and strong analytical skills with a passion to take part in R&D.
About AugRay:
Augray is on a mission to build next generation method of communication using Extended Reality – XR (AR/ VR/ MR) technologies and change the way businesses re conducted and how interactions happen with people. In an age where innovation is happening all around us, there’s commonality – people are driving these changes. We offer a solution that helps to articulate product demonstration and how people conversation takes place using smartphones and wearable glasses.
We are a fast-growing tech start up and have grown to over 100 employees today, launched 3 products and customers across 3 continents including brands like CocaCola, Reliance, Caterpillar, Simpsons and more.
We’re a small and impactful team of engineers, artists, solution geeks continuously working to improve our product and our craft. We use modern, cutting-edge tech stack and love experimenting and patenting with new technologies to create our products and provide opportunities for them to continue to learn and grow into leaders and experts.
We are excited to find a person that has the passion, experience, and ability to own significant R&D tasks and product evolution working individually and or along with a team of virtual engineers.
About the Role:
Research isn’t just a buzzword to you In your role as a Data Science Associate, you will use AI, ML (Machine Learning) to deliver insightful and actionable intelligence and predictive solutions to our team to create innovative solutions for our products. You will gain experience working in AR (Augmented Reality), ML, NLP and developing data driven solutions to create algorithms while working closely with other team members of our Data Science and engineering team to deliver value to our product evolution. Aside from supporting our data science model creation and data teams, you'll also assist the product team with growth opportunities. You over-invest in the visual and interaction and a passion to solve challenges while creating innovative patentable approaches.
Required Skills:
Work with Product Managers and Engineers to dive deep into data and the user experience
Construct product metrics and statistical models to identify growth opportunities
Handle data annotation and data analysis requests from multiple stakeholders with high efficiency and quality in a fast-paced environment.
Help with the development of the annotation guidelines.
Analyze language data and evaluate trends and patterns.
Participate in an annotation tool testing and onboarding.
Track and report quality metrics and ensure delivery on all KPIs and SLAs agreed with stakeholders.
Maximize productivity, process efficiency and quality through streamlined workflows, process standardization, documentation, audits and investigations on a periodic basis.
Qualifications:
Bachelor’s or equivalent experience in Mathematics, Statistics, Econometrics, Computer Science, Electrical or Computer Engineering, or related field
1+ years’ of experience as data scientist, modeling in python or R
Bachelor/master’s degree students pursuing degrees in data science, statistics, applied math, computer science, engineering or other quantitative fields providing sufficient data science foundations
Exposure to writing code (Python preferred, R and SQL okay), collaboration (Git), developing models (machine learning, boosting & bagging algorithms, &/or regression techniques), and performing predictive analytics testing and evaluation (match case analysis, confidence intervals, experimental design, A/B testing, etc.).
A hunger to learn and work on challenging problems.


Location: Remote (work along with other remote engineers)
Compensation: 55K to 60K with benefits
Please contact: interns@wisdominfotech.com
Immigration status: You should be a US Citizen or GC holder
Start Date: ASAP",https://www.indeed.com/rc/clk?jk=3af02d93417e951c&fccid=2e2cd27fc703e613&vjs=3,"$55,000 - $60,000 a year"
5,job_23b1a2fac1a1970e,2023-04-18,United States,Data Scientist,Data Scientist (All Levels),Noblis,Data Scientist (All Levels),"Remote in Reston, VA 20191
+1 location","Responsibilities:
Noblis is seeking to hire Data Scientists (All Levels) in Reston, VA

As a Data Scientist with our team, you will be working with our federal clients to rapidly develop innovative proof of concept and prototype solutions for our clients’ immediate mission challenges. In your role, you will work on multiple projects with teams of other data scientists, software developers, and SMEs to apply the best practices and state of the art data science and machine learning processes. As a data scientist you will be working closely with federal clients providing services to develop AI/ML models and weights to selected data to facilitate object detection, data triage, search/optimization, inference, facial recognition, behavior detection, and automated discovery and decision making, maintaining model versioning system and experience identifying new vulnerabilities in models.

On our team, you will:
Identify, apply, and adapt the latest research methodologies and open source solutions
Develop and train new machine learning models
Identify, curate, and process large data sets
Research, apply, analyze, and document technical approaches and their outcomes
Have opportunities to use various types of compute resources including on premises hardware and cloud resources
Qualifications:
Required minimum skills and knowledge:
All degrees must be in a STEM field such as computer science, statistics, data analytics, computer engineering, mathematics, and physics
Entry-Level: Bachelor's Degree +0-3 years of professional work experience or Master's Degree + 1-2 years of professional work experience
Mid-Level: Bachelor's Degree +3-5 years of professional work experience or Master’s Degree + 2-4 years of professional work experience
Must be a US Citizen and able to obtain necessary clearance
Desired skills and knowledge:
Top Secret clearance
The ideal candidate has proficiency with major data science tools and languages such as Python, R, NiFi, PostgreSQL/SQL, Spark, and Git
Demonstrated experience with cleaning, managing, optimizing performance with, and processing large volumes of data
The Data Scientist has familiarity with industry best practices for software/hardware optimization when processing large data sets and offers experience in the following required task areas: experience with machine learning, statistical modeling, time-series forecasting, and/or geospatial analytics; experience with Hadoop, Spark, or other parallel storage/computing processes is a plus

#nowhiring
#externalreferral
#hotjobs
Client Engagement: · Learn about and support Noblis’ client engagement, corporate values, and corporate strategic priorities, including providing input to proposal writers. · Build a productive relationship with your client and understand their structure and goals. · Participate in the proposal process by providing input to proposal writers. Overview:
At Noblis we recognize and reward your contributions, provide you with growth opportunities, and support your total well-being. Our offerings include health, life, disability, financial, and retirement benefits, as well as paid leave, professional development, tuition assistance, and work-life programs. Our award programs acknowledge employees for exceptional performance and superior demonstration of our service standards. Full-time and part-time employees working at least 20 hours a week on a regular basis are eligible to participate in our benefit programs. Other offerings may be provided for employees not within this category. We encourage you to learn more about our total benefits by visiting the Benefits page on our Careers site.

Salary at Noblis is determined by various factors, including but not limited to, the combination of education, certifications, knowledge, skills, competencies, and experience, internal and external equity, location, and clearance level, as well as contract-specific affordability and organizational requirements and applicable employment laws. The projected compensation range for this position is provided within the posting and are based on full time status. Part time staff receive a prorated salary based on regularly scheduled hours. The estimated minimum and maximum displayed represents the broadest range for this position (inclusive of high geographic and high clearance requirements), and is just one component of Noblis’ total compensation package for employees.

With the continuing impacts of COVID-19 around the world, we are taking action to protect the health and well-being of our colleagues and maintain the safety of the communities where we operate. Noblis seeks an environment free from COVID-19 and prefers all employees to be fully vaccinated for COVID-19. Attestation of vaccination status will be required for employment with Noblis. Unvaccinated employees may be subject to additional health and safety requirements to include any federal, state and/or client restrictions.

Noblis and our wholly owned subsidiaries, Noblis ESI, and Noblis MSD tackle the nation's toughest problems and apply advanced solutions to our clients' most critical missions. We bring the best of scientific thought, management, and engineering expertise together in an environment of independence and objectivity to deliver enduring impact on federal missions. Noblis works with a wide range of government clients in the defense, intelligence and federal civil sectors. Learn more at Noblis -About Us

Why work at a Noblis company?
Our employees find greater meaning in their work and balance the other things in life that matter to them. Our people are our greatest asset. They are exceptionally skilled, knowledgeable, team-oriented, and mission-driven individuals who want to do work that matters and benefits the public. Noblis has won numerous workplace awards. Noblis maintains a drug-free workplace.

Noblis is an Equal Opportunity Employer. Employment decisions are made without regard to race (as well as because of or on the basis of traits historically associated with race, including hair texture, hair type, and protective hairstyles such as braids, locks, and twists), color, religion, national origin, gender, sexual orientation, gender identity, age, physical or mental disability, pregnancy, childbirth, lactation and related medical conditions, genetic factors, military/veteran status, or other characteristics protected by law.

Noblis is committed to the full inclusion of all qualified individuals. As part of this commitment, Noblis will ensure that persons with disabilities are provided reasonable accommodations. If reasonable accommodation is needed to participate in the job application or interview process, to perform essential job functions, and/or to receive other benefits and privileges of employment, please contact employee-relations@noblis.org .",https://www.indeed.com/rc/clk?jk=23b1a2fac1a1970e&fccid=05d6cb8b919478a9&vjs=3,Estimated $57.3K - $72.6K a year
