,job_id,scraped_date,country,job_name,job_post_date,job_company,job_title,job_location,job_description,job_link,job_salary
6,job_9819e647358a7d40,2023-04-18,United States,Data Scientist,Data Scientist II - Hybrid,Radian,Data Scientist II - Hybrid,"New York, NY 10016 
(Gramercy area)","See yourself at Radian? We see you here too.
At Radian, we see you. For the person you are and the potential you hold. That’s why we’ve embraced a new way of working that lets our people across the country be themselves, be their best and be their boldest. Because when each of us is truly seen, each of us gives our best – and at Radian, we’ll give you our best right back.
See Yourself as a Data Scientist II
The Data Scientist II, MIRS primary function is estimating, validating, monitoring, and implementing consumer credit models focused on mortgage default and prepayment. This requires the use of statistical and econometric methods within a structural modeling framework while leveraging cloud computing solutions. Models will be applied to estimate mortgage insurance cash flows including claim incidence, claim severity, required capital, expected premium, return on equity, existing mortgage insurance policy attrition, and new insurance policy acquisition. The position requires the Credit Modeler II to research, develop and make recommended changes to existing models and new models. Cash flow valuation of primary mortgage insurance policies, structured mortgage insurance policies, mortgage-backed derivatives, reinsurance, and other risk-transfer transactions are also within the position’s scope of analysis. Additional responsibilities may include supporting economic scenario simulation, economic capital, and portfolio optimization. Responsibilities include leveraging machine learning, AI and econometrics in hybrid model design using Big Data and unstructured data to cultivate and leverage business insights. The position requires the ability to effectively communicate technical findings and recommendations to nontechnical managements teams.
See Your Primary Duties and Responsibilities
Delinquency, default, prepayment, claim severity model estimation and design.
Programming in support of model estimation, implementation, monitoring, and back testing
Creation of analytical presentations and communication of strategic business findings to management
Analysis and recommendations on alternative credit structures, risk sharing arrangements, and/or non-traditional manners in which to participate and take on credit risk as appropriate and necessary
Data manipulation of large files (R, Python, or SAS datasets) to identify trends and make recommendations and/or adjustments to credit/portfolio guidelines as necessary
Model development and methodology research
Perform other duties as assigned or apparent.
See the Job Specifications
Your Knowledge:
Expert understanding of mortgage delinquency, default, prepayment and loss given default modeling. Expert mathematical, statistical, and econometric understanding.
Strong analytical background, along with the ability and willingness to effectively make recommendations on transactions based on sound business judgment.
Expert in SAS, R, C++ or python for data analysis and modeling.
Experience leveraging AWS based applications and resources (EC2, EMR, S3, Lambda, Jupyter Notebook, Zeppelin, Spark) is desirable.
Expert mathematical, statistical, and econometric knowledge.
Strong understanding of financial analysis of structured mortgage products.
Your Skills and Abilities:
Expert in SAS, R, or python and proficient in Excel for data analysis.
Experience leveraging cloud computing.
Able to work in a team environment.
Able to effectively summarize and communicate relevant findings and other information.
Your Education, Certifications and Prior Work-Related Experience:
Degree Requirement: Master's Degree or Equivalent Experience
Degree Preferred: Master's Degree or Equivalent Experience
Certifications: Quantitative Field
Work Experience: 4 or more years of prior work related experience
See Your Location
This is a hybrid position, based out of our New York City location, requiring 2- 3 days in office per week.
Radian is committed to a flexible work environment for many of our roles. This role is hybrid and will provide you the flexibility to work both in office and at your designated *Work From Anywhere* location each week.

Work From Anywhere is subject to Radian’s Alternative Work Policy and business needs
See Why You Should Work With Us
Competitive Compensation: anticipated base salary from $95,000 to $135,700 based on skills and experience. This position is eligible to participate in an annual incentive program.
Our Company Makes an Impact. We’ve been recognized by multiple organizations like Bloomberg’s Gender-Equality Index, HousingWire’s Tech 100, and The Forum of Executive Women’s Champion of Board Diversity. Radian has also pledged to PwC’s CEO Action for Diversity & Inclusion commitment.
Rest and Relaxation. This role is eligible for 25 days of paid time off annually, which is prorated in the year of hire based on hire date. In addition, based on your hire date, you will be eligible for 9 paid holidays + 2 floating holiday in support of our DEI culture.
Health & Welfare Benefits. Multiple medical plan choices, including HSA and FSA options, dental, vision, and basic life insurance.
Prepare for your Future. 401(k) with a top of market company match (did we mention the company match is immediately vested?!) and an opportunity to participate in Radian’s Employee Stock Purchase Plan (ESPP).
Paid Parental Leave. An opportunity for all new parents to embrace this exciting change in their lives.
Employee Assistance and Discount Programs. From helping you navigate the healthcare system, to providing resources and assistance to parents and caregivers of children with development disabilities, to scoring discounts with thousands of retailers.
Pet Insurance. To help protect our furry family members.
See More About Radian
Radian is a fintech servicing the mortgage and real estate services industry. As a team, we pride ourselves on seeing the potential of every person, every idea and every day.
Seeing each other at Radian goes far beyond our open, flexible culture. It means seeing our people’s potential – and creating inspiring career paths that help them get there. Or seeing new pathways and innovating for the future of our industry. It means seeing each other for all that we are. And it means seeing our purpose as one that extends beyond the bottom line – having an impact on communities across the country to help more people achieve the American Dream of homeownership.
We hope you’ll see yourself at Radian. See more about us at Radian.com.
Defining Roles for Radian's Future
Understanding the qualities and characteristics that define a Leader and an Employee is important to building our future-fit workforce. Radian's future is only as bright as its people. For that reason, our People Plan includes profiles to support the qualities and characteristics that each Leader as well as each Employee should embody upon hire or via development.
EEO Statement
Radian complies with all applicable federal, state, and local laws prohibiting discrimination in employment. All qualified applicants will receive consideration for employment without regard to gender, age, race, color, religious creed, marital status, gender identity, sexual orientation, national origin, ethnicity, ancestry, citizenship, genetic information, disability, protected veteran status or any other characteristic protected by applicable federal, state, or local law.

Equal Opportunity Employer Details
View the ""EEO is the Law"" poster [Link]. View the ""EEO is the Law"" Supplement [Link]. View Pay Transparency Nondiscrimination Provision [Link].

Accommodation
Whether you require an accommodation for the job application or interview process, Radian is dedicated to a barrier-free employment process and encourages a diverse workforce. If you have questions about the accommodation process, please e-mail careers@radian.com.",https://www.indeed.com/rc/clk?jk=9819e647358a7d40&fccid=49bacaf9ea5daa22&vjs=3,"$95,000 - $135,700 a year"
7,job_4da612ed7a1fbfd2,2023-04-18,United States,Data Scientist,Data Scientist,Pinterest,Data Scientist,"+3 locations
Remote","About Pinterest:
Millions of people across the world come to Pinterest to find new ideas every day. It’s where they get inspiration, dream about new possibilities and plan for what matters most. Our mission is to help those people find their inspiration and create a life they love. In your role, you’ll be challenged to take on work that upholds this mission and pushes Pinterest forward. You’ll grow as a person and leader in your field, all the while helping Pinners make their lives better in the positive corner of the internet.
Our new progressive work model is called PinFlex, a term that’s uniquely Pinterest to describe our flexible approach to living and working. Visit our PinFlex landing page to learn more.
As a Data Scientist you will shape the future of people-facing and business-facing products we build at Pinterest. Your expertise in quantitative modeling, experimentation and algorithms will be utilized to solve some of the most complex engineering challenges at the company. You will collaborate on a wide array of product and business problems with a diverse set of cross-functional partners across Product, Engineering, Design, Research, Product Analytics, Data Engineering and others. The results of your work will influence and uplevel our product development teams while introducing greater scientific rigor into the real world products serving hundreds of millions of pinners, creators, advertisers and merchants around the world.
What you'll do
Develop best practices for instrumentation and experimentation and communicate those to product engineering teams to help us fulfill our mission - to bring everyone the inspiration to create a life they love
Bring scientific rigor and statistical methods to the challenges of product creation, development and improvement with an appreciation for the behaviors of our Pinners
Build and prototype analysis pipelines iteratively to provide insights at scale while developing comprehensive knowledge of data structures and metrics, advocating for changes where needed for product development
Work cross-functionally to build and communicate key insights, and collaborate closely with product managers, engineers, designers, and researchers to help build the next experiences on Pinterest
What we're looking for
4+ years of experience analyzing data in a fast-paced, data-driven environment with proven ability to apply scientific methods to solve real-world problems on web-scale data
Extensive experience solving analytical problems using quantitative approaches including in the fields of Machine Learning, Statistical Modeling, Forecasting, Econometrics or other related fields
Experience using machine learning and deep learning frameworks, such as PyTorch, TensorFlow or scikit-learn
A scientifically rigorous approach to analysis and data, and a well-tuned sense of skepticism, attention to detail and commitment to high-quality, results-oriented output
Ability to manipulate large data sets with high dimensionality and complexity; fluency in SQL (or other database languages) and a scripting language (Python or R)
Excellent communication skills and ability to explain learnings to both technical and non-technical partners
A team player who's able to partner with cross-functional leadership to quickly turn insights into actions
This position is not eligible for relocation assistance.
#LI-REMOTE
#LI-NM4
At Pinterest we believe the workplace should be equitable, inclusive, and inspiring for every employee. In an effort to provide greater transparency, we are sharing the base salary range for this position. The position is also eligible for equity. Final salary is based on a number of factors including location, travel, relevant prior experience, or particular skills and expertise.
Information regarding the culture at Pinterest and benefits available for this position can be found here.
US based applicants only
$145,700—$258,700 USD
Our Commitment to Diversity:
Pinterest is an equal opportunity employer and makes employment decisions on the basis of merit. We want to have the best qualified people in every job. All qualified applicants will receive consideration for employment without regard to race, color, religion, sex, sexual orientation, gender identity, national origin, disability, protected veteran status, or any other characteristic under federal, state, or local law. We also consider qualified applicants regardless of criminal histories, consistent with legal requirements. If you require an accommodation during the job application process, please notify accessibility@pinterest.com for support.

Not Specified
0",https://www.indeed.com/rc/clk?jk=4da612ed7a1fbfd2&fccid=43014b1412e0a7b6&vjs=3,Estimated $164K - $208K a year
8,job_67a4f3249130882a,2023-04-18,United States,Data Scientist,Data Scientist - Remote,OneDigital,Data Scientist - Remote,Remote,"Are you looking to accelerate your career without having to hide your authentic self - a place where you can be you? A career that’s making a bigger impact on the world? At OneDigital, we are on a mission to help people do their best work and live their best lives. From the services we offer to the way we show up for each other each day, we are fueling dreams, achieving big goals, and embracing each other’s truest selves.
We understand that pursuing a new job is a big deal. Maybe you’re afraid you won’t fit in. Well, here’s the good news. For us, the days of “fit in to get in” are over and being different is not a barrier to getting ahead. Greatness comes in all shapes, sizes, colors, and experience levels. If you are looking for a people-first culture that is wired for growth, driven to serve, and totally committed to having your back, give us a shot. Your best life awaits.
Our Newest Opportunity:
Summary:
The National Analytics Team at OneDigital is responsible for developing tools/models and for managing client projects that focus on employers’ health benefits strategies, including financial projections, carrier selection, plan design optimization, employee contribution setting, IBNR valuations, benchmarking, well-being initiatives, and renewal negotiations. Centralized at corporate, the department works both with field office analytics and consulting leaders, as well as directly with large clients. The team helps OneDigital colleagues and clients evaluate and optimize their health and welfare programs.
As a part of the R&D team, the Data Scientist helps to develop new models and tools that our local consultants will use to service their individual clients. This position provides the opportunity to work with many key thought leaders across each region as we further innovate and digitize our overall strategy when it comes to consulting.

Essential Duties and Responsibilities (include but are not limited to):
Assist in developing models/tools that will be used across the company
Assist in audits to ensure integrity of data
Debug, test, and maintain new and existing models
Provide R&D support and manage model enhancement requests
Train users/answer questions on new models/developments
Skills:
2+ years of experience with advanced Excel /VBA best practices to create Macros with code that is easy to understand, transferable and easy to maintain
Experience working with visualizing tools such as Tableau, Power BI, Pivots/Advanced Excel
Proficiency in data visualization and scripting/programming languages (SQL, R, Python) desired
Comfortable working with complex data sets
Actively seek out ways to improve processes, reduce risk, increase productivity and lower costs
Self-motivated, Well-organized high achiever with the ability to handle several projects/tasks simultaneously
Fast learner with strong problem solving and quantitative skillset
Critical thinker with ability to see the big picture
Dedicated work ethic with a commitment to client service excellence
Education, Training and Experience:
Bachelor's/Master's degree in fields such as: data science, data engineering, data mining, computer science, computer engineering, statistics, mathematics, or equivalent quantitative discipline
2-5 years of relevant work experience
Relevant health actuarial consulting and/or health plan/insurance company experience (preferred)
Thank you for your interest in joining the OneDigital team!",https://www.indeed.com/rc/clk?jk=67a4f3249130882a&fccid=83cb647156059a60&vjs=3,Estimated $83.7K - $106K a year
9,job_c4bbc804c7f47469,2023-04-18,United States,Data Scientist,"Research Data Scientist, Tatonetti Lab",CEDARS-SINAI,"Research Data Scientist, Tatonetti Lab","West Hollywood, CA
+7 locations","The Research Data Scientist participates in biomedical research projects using programming, data-mining, statistics, machine learning, and visualization techniques to develop, evaluate, and/or apply algorithms and software for data analysis. Responsibilities include querying databases, data processing, supervised and unsupervised machine learning, deploying production models, and communication of scientific findings via peer-reviewed publications and scientific conferences. Writes clean, performant, reusable code managed on GitHub to perform repeatable analyses and to train and deploy models to multiple environments.
The Research Data Scientist in the Tatonetti Lab at Cedars-Sinai will conduct research to improve translational cancer research by leveraging clinical and molecular data. In the Tatonetti Lab we use advanced data science methods, including artificial intelligence and machine learning, to investigate drug safety, drug-drug interactions, and cancer pharmacology and to improve the cancer clinical trials process. Using emerging resources, such as electronic health records (EHR) and genomics databases, we are working to advance the science of pharmacology with a focus on serving traditionally underrepresented populations.
Primary Duties and Responsibilities
Assists with the development, evaluation, and/or application of computational and statistical methods including artificial intelligence and machine learning algorithms and software for the analysis of biomedical data.
Assists with the presentation and communication of scientific results through laboratory meetings, scientific conferences, and peer-reviewed publications.
Creates database-to-deployment pipelines for models using the necessary programming languages (primarily R, Python, SQL).
Creates sustainable data science infrastructure and adheres to data analysis/machine learning best practices.
Performs exploratory data analysis to gauge the need for or appropriateness of advanced analytical methods.
Works with senior or lead data scientists and principal investigators to identify areas where data science can best be applied to answer biomedical research questions.
Tests and validates code to ensure robustness of data applications with version control through GitHub.
Performs all other duties as assigned.

Requirements:
Bachelor's Degree - computer science, machine learning, applied mathematics, econometrics, statistics, engineering, physics, or related discipline.
Experience working with Cancer data modalities
Preferred:
Master's Degree - computer science, machine learning, applied mathematics, econometrics, statistics, engineering, physics, or related discipline.
2-5 years professional experience in healthcare or pharmaceutical industries working with biomedical data
Experience programming at an intermediate skill level with a high-level programming language such as R or Python. College projects may be acceptable.
Experience programming at a basic to intermediate proficiency level in SQL
2-5 years of experience in biomedical machine learning is preferred
Physical Demands:
Standing, Walking, Sitting, Lifting 50 lbs. Carrying 50 lbs. Pushing 50 lbs. Pulling 50 lbs. Reaching, Handling, Grasping, Feeling, Talking, Hearing, Repetitive Motions, Eye/Hand/Foot Coordination


Working Title: Research Data Scientist, Tatonetti Lab
Department: Cancer Institute
Business Entity: Cedars-Sinai Medical Center
Job Category: Family & Function,Cedars-Sinai Medical Center,Family & Function,Cedars-Sinai Medical Center
Job Specialty: UNASSIGNED
Position Type: Full-time
Shift Length: 8 hour shift
Shift Type: Day
Base Pay:$45.56 - $77.45",https://www.indeed.com/rc/clk?jk=c4bbc804c7f47469&fccid=22d99361dca0507f&vjs=3,$45.56 - $77.45 an hour
